{
  "dataset_id": "aeroworld_70_scenarios_3_seeds",
  "episode_count": 210,
  "episodes": [
    {
      "episode_id": "L1-1_v1__seed00",
      "scenario_id": "L1-1_v1",
      "seed": 0
    },
    {
      "episode_id": "L1-1_v1__seed01",
      "scenario_id": "L1-1_v1",
      "seed": 1
    },
    {
      "episode_id": "L1-1_v1__seed02",
      "scenario_id": "L1-1_v1",
      "seed": 2
    },
    {
      "episode_id": "L1-1_v2__seed00",
      "scenario_id": "L1-1_v2",
      "seed": 0
    },
    {
      "episode_id": "L1-1_v2__seed01",
      "scenario_id": "L1-1_v2",
      "seed": 1
    },
    {
      "episode_id": "L1-1_v2__seed02",
      "scenario_id": "L1-1_v2",
      "seed": 2
    },
    {
      "episode_id": "L1-2_v1__seed00",
      "scenario_id": "L1-2_v1",
      "seed": 0
    },
    {
      "episode_id": "L1-2_v1__seed01",
      "scenario_id": "L1-2_v1",
      "seed": 1
    },
    {
      "episode_id": "L1-2_v1__seed02",
      "scenario_id": "L1-2_v1",
      "seed": 2
    },
    {
      "episode_id": "L1-3_v1__seed00",
      "scenario_id": "L1-3_v1",
      "seed": 0
    },
    {
      "episode_id": "L1-3_v1__seed01",
      "scenario_id": "L1-3_v1",
      "seed": 1
    },
    {
      "episode_id": "L1-3_v1__seed02",
      "scenario_id": "L1-3_v1",
      "seed": 2
    },
    {
      "episode_id": "L1-3_v2__seed00",
      "scenario_id": "L1-3_v2",
      "seed": 0
    },
    {
      "episode_id": "L1-3_v2__seed01",
      "scenario_id": "L1-3_v2",
      "seed": 1
    },
    {
      "episode_id": "L1-3_v2__seed02",
      "scenario_id": "L1-3_v2",
      "seed": 2
    },
    {
      "episode_id": "L1-4_v1__seed00",
      "scenario_id": "L1-4_v1",
      "seed": 0
    },
    {
      "episode_id": "L1-4_v1__seed01",
      "scenario_id": "L1-4_v1",
      "seed": 1
    },
    {
      "episode_id": "L1-4_v1__seed02",
      "scenario_id": "L1-4_v1",
      "seed": 2
    },
    {
      "episode_id": "L1-4_v2__seed00",
      "scenario_id": "L1-4_v2",
      "seed": 0
    },
    {
      "episode_id": "L1-4_v2__seed01",
      "scenario_id": "L1-4_v2",
      "seed": 1
    },
    {
      "episode_id": "L1-4_v2__seed02",
      "scenario_id": "L1-4_v2",
      "seed": 2
    },
    {
      "episode_id": "L2-1_v1__seed00",
      "scenario_id": "L2-1_v1",
      "seed": 0
    },
    {
      "episode_id": "L2-1_v1__seed01",
      "scenario_id": "L2-1_v1",
      "seed": 1
    },
    {
      "episode_id": "L2-1_v1__seed02",
      "scenario_id": "L2-1_v1",
      "seed": 2
    },
    {
      "episode_id": "L2-1_v2__seed00",
      "scenario_id": "L2-1_v2",
      "seed": 0
    },
    {
      "episode_id": "L2-1_v2__seed01",
      "scenario_id": "L2-1_v2",
      "seed": 1
    },
    {
      "episode_id": "L2-1_v2__seed02",
      "scenario_id": "L2-1_v2",
      "seed": 2
    },
    {
      "episode_id": "L2-2_v1__seed00",
      "scenario_id": "L2-2_v1",
      "seed": 0
    },
    {
      "episode_id": "L2-2_v1__seed01",
      "scenario_id": "L2-2_v1",
      "seed": 1
    },
    {
      "episode_id": "L2-2_v1__seed02",
      "scenario_id": "L2-2_v1",
      "seed": 2
    },
    {
      "episode_id": "L2-2_v2__seed00",
      "scenario_id": "L2-2_v2",
      "seed": 0
    },
    {
      "episode_id": "L2-2_v2__seed01",
      "scenario_id": "L2-2_v2",
      "seed": 1
    },
    {
      "episode_id": "L2-2_v2__seed02",
      "scenario_id": "L2-2_v2",
      "seed": 2
    },
    {
      "episode_id": "L2-3_v1__seed00",
      "scenario_id": "L2-3_v1",
      "seed": 0
    },
    {
      "episode_id": "L2-3_v1__seed01",
      "scenario_id": "L2-3_v1",
      "seed": 1
    },
    {
      "episode_id": "L2-3_v1__seed02",
      "scenario_id": "L2-3_v1",
      "seed": 2
    },
    {
      "episode_id": "L2-3_v2__seed00",
      "scenario_id": "L2-3_v2",
      "seed": 0
    },
    {
      "episode_id": "L2-3_v2__seed01",
      "scenario_id": "L2-3_v2",
      "seed": 1
    },
    {
      "episode_id": "L2-3_v2__seed02",
      "scenario_id": "L2-3_v2",
      "seed": 2
    },
    {
      "episode_id": "L2-4_v1__seed00",
      "scenario_id": "L2-4_v1",
      "seed": 0
    },
    {
      "episode_id": "L2-4_v1__seed01",
      "scenario_id": "L2-4_v1",
      "seed": 1
    },
    {
      "episode_id": "L2-4_v1__seed02",
      "scenario_id": "L2-4_v1",
      "seed": 2
    },
    {
      "episode_id": "L2-4_v2__seed00",
      "scenario_id": "L2-4_v2",
      "seed": 0
    },
    {
      "episode_id": "L2-4_v2__seed01",
      "scenario_id": "L2-4_v2",
      "seed": 1
    },
    {
      "episode_id": "L2-4_v2__seed02",
      "scenario_id": "L2-4_v2",
      "seed": 2
    },
    {
      "episode_id": "L2-5_v1__seed00",
      "scenario_id": "L2-5_v1",
      "seed": 0
    },
    {
      "episode_id": "L2-5_v1__seed01",
      "scenario_id": "L2-5_v1",
      "seed": 1
    },
    {
      "episode_id": "L2-5_v1__seed02",
      "scenario_id": "L2-5_v1",
      "seed": 2
    },
    {
      "episode_id": "L3-1_v1__seed00",
      "scenario_id": "L3-1_v1",
      "seed": 0
    },
    {
      "episode_id": "L3-1_v1__seed01",
      "scenario_id": "L3-1_v1",
      "seed": 1
    },
    {
      "episode_id": "L3-1_v1__seed02",
      "scenario_id": "L3-1_v1",
      "seed": 2
    },
    {
      "episode_id": "L3-2_v1__seed00",
      "scenario_id": "L3-2_v1",
      "seed": 0
    },
    {
      "episode_id": "L3-2_v1__seed01",
      "scenario_id": "L3-2_v1",
      "seed": 1
    },
    {
      "episode_id": "L3-2_v1__seed02",
      "scenario_id": "L3-2_v1",
      "seed": 2
    },
    {
      "episode_id": "L3-2_v2__seed00",
      "scenario_id": "L3-2_v2",
      "seed": 0
    },
    {
      "episode_id": "L3-2_v2__seed01",
      "scenario_id": "L3-2_v2",
      "seed": 1
    },
    {
      "episode_id": "L3-2_v2__seed02",
      "scenario_id": "L3-2_v2",
      "seed": 2
    },
    {
      "episode_id": "L3-3_v1__seed00",
      "scenario_id": "L3-3_v1",
      "seed": 0
    },
    {
      "episode_id": "L3-3_v1__seed01",
      "scenario_id": "L3-3_v1",
      "seed": 1
    },
    {
      "episode_id": "L3-3_v1__seed02",
      "scenario_id": "L3-3_v1",
      "seed": 2
    },
    {
      "episode_id": "L3-3_v2__seed00",
      "scenario_id": "L3-3_v2",
      "seed": 0
    },
    {
      "episode_id": "L3-3_v2__seed01",
      "scenario_id": "L3-3_v2",
      "seed": 1
    },
    {
      "episode_id": "L3-3_v2__seed02",
      "scenario_id": "L3-3_v2",
      "seed": 2
    },
    {
      "episode_id": "L4-1_v1__seed00",
      "scenario_id": "L4-1_v1",
      "seed": 0
    },
    {
      "episode_id": "L4-1_v1__seed01",
      "scenario_id": "L4-1_v1",
      "seed": 1
    },
    {
      "episode_id": "L4-1_v1__seed02",
      "scenario_id": "L4-1_v1",
      "seed": 2
    },
    {
      "episode_id": "L4-1_v2__seed00",
      "scenario_id": "L4-1_v2",
      "seed": 0
    },
    {
      "episode_id": "L4-1_v2__seed01",
      "scenario_id": "L4-1_v2",
      "seed": 1
    },
    {
      "episode_id": "L4-1_v2__seed02",
      "scenario_id": "L4-1_v2",
      "seed": 2
    },
    {
      "episode_id": "L4-2_v1__seed00",
      "scenario_id": "L4-2_v1",
      "seed": 0
    },
    {
      "episode_id": "L4-2_v1__seed01",
      "scenario_id": "L4-2_v1",
      "seed": 1
    },
    {
      "episode_id": "L4-2_v1__seed02",
      "scenario_id": "L4-2_v1",
      "seed": 2
    },
    {
      "episode_id": "L4-2_v2__seed00",
      "scenario_id": "L4-2_v2",
      "seed": 0
    },
    {
      "episode_id": "L4-2_v2__seed01",
      "scenario_id": "L4-2_v2",
      "seed": 1
    },
    {
      "episode_id": "L4-2_v2__seed02",
      "scenario_id": "L4-2_v2",
      "seed": 2
    },
    {
      "episode_id": "L4-4_v1__seed00",
      "scenario_id": "L4-4_v1",
      "seed": 0
    },
    {
      "episode_id": "L4-4_v1__seed01",
      "scenario_id": "L4-4_v1",
      "seed": 1
    },
    {
      "episode_id": "L4-4_v1__seed02",
      "scenario_id": "L4-4_v1",
      "seed": 2
    },
    {
      "episode_id": "L4-4_v2__seed00",
      "scenario_id": "L4-4_v2",
      "seed": 0
    },
    {
      "episode_id": "L4-4_v2__seed01",
      "scenario_id": "L4-4_v2",
      "seed": 1
    },
    {
      "episode_id": "L4-4_v2__seed02",
      "scenario_id": "L4-4_v2",
      "seed": 2
    },
    {
      "episode_id": "L4-5_v1__seed00",
      "scenario_id": "L4-5_v1",
      "seed": 0
    },
    {
      "episode_id": "L4-5_v1__seed01",
      "scenario_id": "L4-5_v1",
      "seed": 1
    },
    {
      "episode_id": "L4-5_v1__seed02",
      "scenario_id": "L4-5_v1",
      "seed": 2
    },
    {
      "episode_id": "L4-5_v2__seed00",
      "scenario_id": "L4-5_v2",
      "seed": 0
    },
    {
      "episode_id": "L4-5_v2__seed01",
      "scenario_id": "L4-5_v2",
      "seed": 1
    },
    {
      "episode_id": "L4-5_v2__seed02",
      "scenario_id": "L4-5_v2",
      "seed": 2
    },
    {
      "episode_id": "L4-5_v3__seed00",
      "scenario_id": "L4-5_v3",
      "seed": 0
    },
    {
      "episode_id": "L4-5_v3__seed01",
      "scenario_id": "L4-5_v3",
      "seed": 1
    },
    {
      "episode_id": "L4-5_v3__seed02",
      "scenario_id": "L4-5_v3",
      "seed": 2
    },
    {
      "episode_id": "L4-6_v1__seed00",
      "scenario_id": "L4-6_v1",
      "seed": 0
    },
    {
      "episode_id": "L4-6_v1__seed01",
      "scenario_id": "L4-6_v1",
      "seed": 1
    },
    {
      "episode_id": "L4-6_v1__seed02",
      "scenario_id": "L4-6_v1",
      "seed": 2
    },
    {
      "episode_id": "L4-6_v2__seed00",
      "scenario_id": "L4-6_v2",
      "seed": 0
    },
    {
      "episode_id": "L4-6_v2__seed01",
      "scenario_id": "L4-6_v2",
      "seed": 1
    },
    {
      "episode_id": "L4-6_v2__seed02",
      "scenario_id": "L4-6_v2",
      "seed": 2
    },
    {
      "episode_id": "L4-9_v1__seed00",
      "scenario_id": "L4-9_v1",
      "seed": 0
    },
    {
      "episode_id": "L4-9_v1__seed01",
      "scenario_id": "L4-9_v1",
      "seed": 1
    },
    {
      "episode_id": "L4-9_v1__seed02",
      "scenario_id": "L4-9_v1",
      "seed": 2
    },
    {